{
  "schema_id": "p120.reference_print_document",
  "schema_version": "1.0.0",
  "architecture_id": "P120-REP-ARCH-001/v1.0",
  "report_id": "RPT-SYNTH-REF-001",
  "publication_authorization": "EXPERT_ONLY",
  "language": "ru",
  "title": "P-120 — индивидуальный аналитический отчёт",
  "pages": [
    {
      "page_class": "cover",
      "heading": "P-120",
      "subtitle": "Индивидуальный аналитический отчёт",
      "note": "Белая печатная редакция · синтетический эталон · не является реальным результатом респондента",
      "blocks": []
    },
    {
      "page_class": "how_to_read",
      "heading": "Как читать этот отчёт",
      "intro": "Отчёт разделяет измеренные результаты, детерминированные выводы, интерпретацию и исследовательские вопросы. Цвет является только дополнительным сигналом; класс всегда обозначен текстом и формой линии.",
      "blocks": [
        {
          "element_id": "ELEM-HTR-001",
          "evidence_class": "L1",
          "source_state": "available",
          "source_ids": ["CLM-SYNTH-001"],
          "title": "Измерено",
          "text": "Прямой результат авторизованного измерения. Числовое значение показывается только при наличии разрешённой шкалы.",
          "visible_state": "Источник доступен"
        },
        {
          "element_id": "ELEM-HTR-002",
          "evidence_class": "L2",
          "source_state": "available",
          "source_ids": ["SYN-SYNTH-001"],
          "title": "Выведено по правилу",
          "text": "Детерминированная связь или флаг, полученный из контролируемого правила. Это не новый ответ человека.",
          "visible_state": "Правило применимо"
        },
        {
          "element_id": "ELEM-HTR-003",
          "evidence_class": "L3",
          "source_state": "available",
          "source_ids": ["CLM-SYNTH-001", "CLM-SYNTH-002"],
          "title": "Интерпретация",
          "text": "Разрешённое смысловое объяснение на основе уже доступных результатов; не отдельная шкала и не диагноз."
        },
        {
          "element_id": "ELEM-HTR-004",
          "evidence_class": "L4",
          "source_state": "available",
          "source_ids": ["CLM-SYNTH-003"],
          "title": "Исследовательское",
          "text": "Вопрос для размышления или гипотеза, которая не выдаётся за установленный факт."
        }
      ]
    },
    {
      "page_class": "executive_portrait",
      "heading": "Короткий портрет",
      "intro": "Синтетический пример показывает только архитектуру подачи. Значения не принадлежат реальному человеку.",
      "blocks": [
        {
          "element_id": "ELEM-EXP-001",
          "evidence_class": "L1",
          "source_state": "available",
          "source_ids": ["CLM-SYNTH-010"],
          "title": "Выраженность визуально-тактильной организации",
          "text": "В синтетическом профиле эта координата выражена выше нейтральной зоны.",
          "numeric_value": 72,
          "unit": "индекс"
        },
        {
          "element_id": "ELEM-EXP-002",
          "evidence_class": "L2",
          "source_state": "available",
          "source_ids": ["SYN-SYNTH-010"],
          "title": "Согласованность двух связанных признаков",
          "text": "Контролируемое правило указывает на совместное присутствие признаков без утверждения причинности."
        },
        {
          "element_id": "ELEM-EXP-003",
          "evidence_class": "L3",
          "source_state": "partial",
          "source_ids": ["CLM-SYNTH-010", "CLM-SYNTH-011"],
          "title": "Что важно не переинтерпретировать",
          "text": "Синтетическая комбинация поддерживает осторожный интегорированный комментарий, но не позволяет выводить устойчивую личностную типологию.",
          "visible_state": "Покрытие частичное"
        }
      ]
    },
    {
      "page_class": "profile_module",
      "heading": "Архитектура притяжения",
      "intro": "Эталонная модульная страница: измеренная структура и контролируемое пояснение остаются различимыми.",
      "blocks": [
        {
          "element_id": "ELEM-MOD-A-001",
          "evidence_class": "L1",
          "source_state": "available",
          "source_ids": ["CLM-SYNTH-020"],
          "title": "Фасет A",
          "text": "Синтетический измеренный показатель.",
          "numeric_value": 64,
          "unit": "индекс"
        },
        {
          "element_id": "ELEM-MOD-A-002",
          "evidence_class": "L1",
          "source_state": "not_exposed",
          "source_ids": ["CLM-SYNTH-021"],
          "title": "Фасет B",
          "text": "Значение не рассчитывается, поскольку соответстврюющая ветвь не предъявлялась.",
          "visible_state": "Не предъявлялась — не ноль"
        },
        {
          "element_id": "ELEM-MOD-A-003",
          "evidence_class": "L3",
          "source_state": "available",
          "source_ids": ["CLM-SYNTH-020"],
          "title": "Контролируемое пояснение",
          "text": "Измеренный фасет можно опесать как заметный компонент текущей архитектуры профиля, не превращая его в глобальную характеристику человека."
        }
      ]
    },
    {
      "page_class": "profile_module",
      "heading": "Телесная организация отклика",
      "intro": "Вторая модульная страница проверяет missingness и различение количественного результата от интерпретации.",
      "blocks": [
        {
          "element_id": "ELEM-MOD-B-001",
          "evidence_class": "L1",
          "source_state": "partial",
          "source_ids": ["CLM-SYNTH-030"],
          "title": "Соматическая пуувствительность",
          "text": "Синтетический показатель доступен при частичном покрытии.",
          "numeric_value": 58,
          "unit": "индекс",
          "visible_state": "Покрытие частичное"
        },
        {
          "element_id": "ELEM-MOD-B-002",
          "evidence_class": "L1",
          "source_state": "missing",
          "source_ids": ["CLM-SYNTH-031"],
          "title": "Контекстуальная вариативность",
          "text": "Нет достаточных данных для вывода.",
          "visible_state": "Нет данных"
        },
        {
          "element_id": "ELEM-MOD-B-003",
          "evidence_class": "L4",
          "source_state": "available",
          "source_ids": ["CLM-SYNTH-030"],
          "title": "Вопрос для дальнейшего наблюдения",
          "text": "Можно исследовать, меняется ли субъективный отклик в разных безопасных контекстах; это вопрос, а не установленный вывод."
        }
      ]
    },
    {
      "page_class": "cross_layer",
      "heading": "Интегрированная картина",
      "intro": "Межуровневый синтез появляется только при наличии разрешённого моста. Расхождение между слоями допускается как самостоятельный результат.",
      "blocks": [
        {
          "element_id": "ELEM-XLY-001",
          "evidence_class": "L2",
          "source_state": "available",
          "source_ids": ["BR-SYNTH-001", "CLM-SYNTH-020", "CLM-SYNTH-030"],
          "title": "Разрешённая связь между слоями",
          "text": "Контролируемое правило разрешает сопоставление двух координат без объединения их в единый суммарный балл."
        },
        {
          "element_id": "ELEM-XLY-002",
          "evidence_class": "L3",
          "source_state": "partial",
          "source_ids": ["BR-SYNTH-001", "CLM-SYNTH-020", "CLM-SYNTH-030"],
          "title": "Синтез",
          "text": "Синтетические слои частично сходятся, но различие покрытия требует сохранить оговорку и не создавать искусственную гармонизацию.",
          "visible_state": "Интерпретация ограничена покрытием"
        }
      ]
    },
    {
      "page_class": "limitations",
      "heading": "Неизвестное и ограничения",
      "intro": "Ограничения являются полноценным смысловым слоем отчёта, а не примечанием мелким шрифтом.",
      "blocks": [
        {
          "element_id": "ELEM-LIM-001",
          "evidence_class": null,
          "source_state": "insufficient_coverage",
          "source_ids": ["CLM-SYNTH-040"],
          "title": "Недостаточное покрытие",
          "text": "Для одной из координат данных недостаточно; рендерер показывает состояние и не подставляет предположение.",
          "visible_state": "Недостаточное покрытие"
        },
        {
          "element_id": "ELEM-LIM-002",
          "evidence_class": null,
          "source_state": "available",
          "source_ids": [],
          "title": "Недиагностическая граница",
          "text": "Отчёт описывает результаты в пределах измерительных и интерпретационных полномочий P-120 и не создаёт клинический диагноз."
        },
        {
          "element_id": "ELEM-LIM-003",
          "evidence_class": "L4",
          "source_state": "available",
          "source_ids": ["CLM-SYNTH-041"],
          "title": "Рефлексивный вопрос",
          "text": "Какие контекстные условия стоит наблюдать в будущем, не превращая единичное наблюдение в устойчивую закономерность?"
        }
      ]
    },
    {
      "page_class": "technical_appendix",
      "heading": "Техническое приложение",
      "intro": "Техническая страница показывает происхождение рендера без раскрытия внутреннего реестра утверждений или необработанных ответов.",
      "fields": [
        ["ID отчёта", "RPT-SYNTH-REF-001"],
        ["Архитектура", "P120-REP-ARCH-001 / v1.0"],
        ["Язык", "RU"],
        ["Публикация", "EXPERT_ONLY"],
        ["Рендерер", "p120.reference_pdf_renderer / 1.0.0"],
        ["Формат", "A4 210 × 297 mm"]
      ],
      "blocks": [
        {
          "element_id": "ELEM-TECH-001",
          "evidence_class": null,
          "source_state": "available",
          "source_ids": [],
          "title": "Приватность",
          "text": "Видимый PDF не содержит внутренний реестр утверждений, необработанные ответы, чувствительный свободный текст или серверный граф доказательств."
        }
      ]
    }
  ]
}
